{
  "partnerName": "EBO Bio Solution UK",
  "logo": "/partners/Untitled design.png",
  "website": "https://ebobio.co.uk",
  "category": "Services",
  "shortDescription": "Bio-analytical workflow execution, mass spectrometry, and assay support.",
  "services": ["Proteomics Assay", "Mass Spectrometry", "Workflow Automation"],
  "discountValue": "50% Member Discount",
  "discountType": "Percentage discount",
  "eligibility": "",
  "terms": "",
  "partnershipSlug": "ebo-bio-solution-150k",
  "verified": true
}
