{
  "partnerName": "HealOra Diagnostics",
  "logo": "/partners/0e79b389-8500-4630-a8b2-a71cd8768b1d.jpeg",
  "website": "https://healora.co.uk",
  "category": "Services",
  "shortDescription": "Clinical Biomarker Analytics & Genomic Diagnostics Consultation.",
  "services": ["Biomarker Discovery", "Genomic Sequencing Consult", "Clinical Trials Analytics"],
  "discountValue": "40% Member Discount",
  "discountType": "Percentage discount",
  "eligibility": "",
  "terms": "",
  "partnershipSlug": "healora-12k",
  "verified": true
}
