{
  "partnerName": "Exovion Inc.",
  "logo": "/partners/be7dcb13-5351-451b-921a-abd55739aea8.jpeg",
  "website": "https://exovion.com",
  "category": "Computing",
  "shortDescription": "High-Performance Cloud Compute & Molecular Dynamics GPU Clusters.",
  "services": ["GPU Acceleration", "MD Clusters", "Bioinformatics Pipeline Hosting"],
  "discountValue": "50% Member Discount",
  "discountType": "Percentage discount",
  "eligibility": "",
  "terms": "",
  "partnershipSlug": "exovion-10k",
  "verified": true
}
