{
  "partnerName": "International Journal of Biotechnology & Computational Science (IJBTCS)",
  "logo": "/partners/Blue Purple Modern Molecule Technology Logo.jpg",
  "website": "https://ijbtcs.org",
  "category": "Publishing",
  "shortDescription": "Peer-reviewed open-access journal covering chemoinformatics and biotechnology.",
  "services": ["Open-Access Publishing", "Fast-Track Peer Review", "DOAJ Indexing"],
  "discountValue": "50% Member Discount",
  "discountType": "Percentage discount",
  "eligibility": "",
  "terms": "",
  "partnershipSlug": "ijbtcs-220k",
  "verified": true
}
